### ISSUE TITLE
s3fs should cache DNS lookups?

### ISSUE THREAD

**Issue by GoogleCodeExporter** [epylar/s3fs#304]
```
Hi there

I'm successfully testing s3fs on an Amazon RH6 virtual - well done! While 
waiting on a "ls -l" to start returning data, I got tcpdump running and was 
surprised to see this (dns name changed to protect the guilty)

19:34:15.894738 IP 10.159.26.168.37435 > 172.16.0.23.domain: 12688+ A? 
s3bucket.s3.amazonaws.com. (39)
19:34:15.894753 IP 10.159.26.168.37435 > 172.16.0.23.domain: 47391+ AAAA? 
s3bucket.s3.amazonaws.com. (39)
19:34:15.894932 IP 172.16.0.23.domain > 10.159.26.168.37435: 12688 2/0/0 CNAME 
s3-1-w.amazonaws.com., A 205.251.242.165 (76)
19:34:15.894980 IP 172.16.0.23.domain > 10.159.26.168.37435: 47391 1/1/0 CNAME 
s3-1-w.amazonaws.com. (115)
19:34:15.912844 IP 10.159.26.168.46590 > 172.16.0.23.domain: 27254+ A? 
s3bucket.s3.amazonaws.com. (39)
19:34:15.912863 IP 10.159.26.168.46590 > 172.16.0.23.domain: 391+ AAAA? 
s3bucket.s3.amazonaws.com. (39)
19:34:15.913044 IP 172.16.0.23.domain > 10.159.26.168.46590: 27254 2/0/0 CNAME 
s3-1-w.amazonaws.com., A 205.251.242.165 (76)
19:34:15.913125 IP 172.16.0.23.domain > 10.159.26.168.46590: 391 1/1/0 CNAME 
s3-1-w.amazonaws.com. (115)


It seems to me that s3fs is doing a DNS lookup for every little call it has to 
make: wouldn't it be more efficient to cache the first successful lookup for 
some short period of time (even 60 seconds)? That would remove some latency 
without unduly affecting reliability?

Thanks for listening!

Jason

===================================================================
The following information is very important in order to help us to help
you.  Omission of the following details may delay your support request or
receive no attention at all.
===================================================================
Version of s3fs being used (s3fs --version):

1.61

Version of fuse being used (pkg-config --modversion fuse): 2.8.7

System information (uname -a): Linu xxxx.el6.x86_64 #1 SMP Tue May 29 17:38:19 
EDT 2012 x86_64 x86_64 x86_64 GNU/Linux


Distro (cat /etc/issue):
Red Hat Enterprise Linux Server release 6.3 (Santiago)

s3fs command line used (if applicable):

/etc/fstab entry (if applicable):

s3fs syslog messages (grep s3fs /var/log/syslog):


```

Original issue reported on code.google.com by `jason.h...@gmail.com` on 1 Nov 2012 at 11:41
